{
  "$schema": "https://docs.torcato.dev/repo-ai/repo-ai.json",
  "agentUser": "rtorcato-bot",
  "maxInFlight": 6,
  "maxFixRounds": 2,
  "maxTasksPerTick": 8,
  "staleMinutes": 45,
  "busyMinutes": 10,
  "idleMinutes": 30,
  "pollSeconds": 180,
  "budgetTokens": 400000,
  "quietStopMinutes": 120,
  "autoMerge": false,
  "ciWorkflow": "ci.yml"
}
